{
  "subject": "Sanji",
  "kind": "character",
  "continuity": "One Piece manga through the end of Wano Country arc",
  "intent": "Preserve the cook and fast kick-based fighter, flaming kicks, aerial movement, and Ifrit Jambe where supported. Respect his fighting principles and the destruction of the Raid Suit by this continuity. Build a playable kit with at least 15 meaningful purchasable upgrades that each change executable behavior. Select a coherent subset instead of claiming exhaustive coverage. Disclose omitted defining abilities and any source limits. Treat numerical damage, costs, cooldowns, range, targeting and unlock progression as explicit gameplay adaptations. Do not invent character powers to meet upgrade count; deepen sourced abilities where possible.",
  "context": {
    "evidencePurpose": "Curated development demonstration, available to generation and review; not an unseen benchmark.",
    "reviewScope": "Selected manga continuity through end of Wano; exclude later manga, anime-only and game-only facts from this request."
  },
  "sources": [
    "https://onepiece.fandom.com/wiki/Sanji/Abilities_and_Powers",
    "https://one-piece.com/character/sanji/index.html"
  ]
}
