{
  "subject": "Roronoa Zoro",
  "kind": "character",
  "continuity": "One Piece manga through the end of Wano Country arc",
  "intent": "Preserve Three Sword Style, cutting attacks including ranged slashes, and Haki swordsmanship. Consider Ashura and King of Hell where evidence supports them. Build a playable kit with at least 15 meaningful purchasable upgrades that each change executable behavior. Select a coherent subset instead of claiming exhaustive coverage. Disclose omitted defining abilities and any source limits. Treat numerical damage, costs, cooldowns, range, targeting and unlock progression as explicit gameplay adaptations. Do not invent character powers to meet upgrade count; deepen sourced abilities where possible.",
  "context": {
    "evidencePurpose": "Curated development demonstration, available to generation and review; not an unseen benchmark.",
    "reviewScope": "Selected manga continuity through end of Wano; exclude later manga, anime-only and game-only facts from this request."
  },
  "sources": [
    "https://onepiece.fandom.com/wiki/Roronoa_Zoro/Abilities_and_Powers",
    "https://one-piece.com/character/zoro/index.html"
  ]
}
