{
  "subject": "Tony Tony Chopper",
  "kind": "character",
  "continuity": "One Piece manga through the end of Wano Country arc",
  "intent": "Produce a faithful playable Straw Hat unit using the current Manga Mayhem contract. Exactly three paths of five concrete cumulative purchases, legal maximum 5-2-0. Every purchase must change executable behavior. Source facts must be established by fresh research. Disclose numerical tuning, unlock schedules and bounded interpretations as game adaptations; distinguish omitted powers from implemented powers. This is a stationary tower encounter with caller-supplied enemy motion and ally injuries, not tower defensive combat or free unit movement. Avoid unsupported air-only target classes, tower HP, shields, taunt, or invented powers. If a source trait has no runtime representation, preserve it in an explicit omission rather than a fake stat bonus. Use the supported schema exactly, including resources, projectile flight, target geometry, statuses, and shared technique lifecycle. Balance is a later measured pass; prices are provisional. World units are shared across the crew: ordinary close contact roughly 8-18, stretched or ranged profiles roughly 30-60; do not treat these as canon measurements. Keep signatures recognizable and source-backed. Doctor, human-reindeer Zoan and distinct ordinary Points, Rumble Ball/Monster Point with Wano duration and aftereffects researched. Support must execute healing to injured living allies. Ordinary Points should use free zero-drain forms, Monster Point uses bounded resource/drain approximation with explicit recovery. Provide the defining form variety and meaningful medical purchases. Do not invent tower defensive combat to justify Guard Point; disclose unavailable defensive effect while preserving faithful visual/form differences. Targeted fresh research focus: Establish all documented ordinary Points, including Brain, Walk, Heavy, Jumping, Arm, Horn, Guard and Kung Fu, distinguishing pre-timeskip Rumble Ball requirements from post-timeskip access and supported form capabilities through Wano. Document Monster Point, modified Rumble Ball duration and Baby Geezer aftereffects with actual manga chapter references and Wano chronology. Investigate medicine, diagnostic Scope, source-supported sense of smell, and Chopperphage as a disease cure: do not infer an enemy damage or slowing attack from a cure. Do not infer internal armor bypass from physical strength. Record what the sources actually establish, including unsupported requirements as gaps. Distinguish canonical duration facts from any runtime stamina/cooldown/healing/targeting adaptations. Six sources are authorized to cover normal forms, drug changes, and Wano-specific Ice Oni treatment in one fresh pipeline research result. No unit generation or old generation content is supplied.",
  "context": {
    "crew": {
      "id": "straw-hats",
      "name": "Straw Hat Pirates",
      "members": [
        "Monkey D. Luffy",
        "Roronoa Zoro",
        "Nami",
        "Usopp",
        "Sanji",
        "Tony Tony Chopper",
        "Nico Robin",
        "Franky",
        "Brook",
        "Jinbe"
      ]
    },
    "cutoff": "One Piece manga through the end of Wano Country arc",
    "newRun": true,
    "coverage": "Character-specific capabilities are requirements to verify, not evidence. Record unsupported facts as gaps. No old generated artifacts supplied."
  },
  "sources": [
    "https://onepiece.fandom.com/wiki/Tony_Tony_Chopper/Abilities_and_Powers",
    "https://onepiece.fandom.com/wiki/Hito_Hito_no_Mi",
    "https://onepiece.fandom.com/wiki/Rumble_Ball",
    "https://one-piece.com/character/chopper/index.html",
    "https://one-piece.com/story/land_of_wano2/index.html",
    "https://onepiece.fandom.com/wiki/Ice_Oni"
  ]
}
